{
  "schemaVersion": "1",
  "mapType": "region",
  "mode": "gm",
  "unit": "mi",
  "extent": {
    "w": 12,
    "h": 8
  },
  "features": [
    {
      "anchor": "the-gumdrop-hills",
      "line": 15,
      "section": "terrain",
      "level": "",
      "word": "gumdrop-hills",
      "archetype": "terrain",
      "chain": [
        "gumdrop-hills",
        "hills"
      ],
      "flags": [],
      "pairs": {
        "size": "2mi"
      },
      "geometry": {
        "kind": "polygon",
        "points": [
          {
            "x": 4.818189961211093,
            "y": 2.9866812459167296
          },
          {
            "x": 4.810718259934767,
            "y": 3.0589677441870573
          },
          {
            "x": 4.814255702491451,
            "y": 3.130885974381832
          },
          {
            "x": 4.820376668875132,
            "y": 3.201454037645076
          },
          {
            "x": 4.820655539079789,
            "y": 3.2696900351208114
          },
          {
            "x": 4.806666693099411,
            "y": 3.3346120679530613
          },
          {
            "x": 4.7747267359816075,
            "y": 3.3953682026901704
          },
          {
            "x": 4.730683155174685,
            "y": 3.451619374692629
          },
          {
            "x": 4.679319457904057,
            "y": 3.506012250217571
          },
          {
            "x": 4.625419151395135,
            "y": 3.5611934955221307
          },
          {
            "x": 4.5737657428733325,
            "y": 3.6198097768634434
          },
          {
            "x": 4.519764037489887,
            "y": 3.699636250979077
          },
          {
            "x": 4.466888489489431,
            "y": 3.790645957963475
          },
          {
            "x": 4.411616440481841,
            "y": 3.8793151664432894
          },
          {
            "x": 4.350425232076993,
            "y": 3.952120145045172
          },
          {
            "x": 4.279792205884762,
            "y": 3.995537162395776
          },
          {
            "x": 4.19895313376121,
            "y": 4
          },
          {
            "x": 4.1090855277986895,
            "y": 3.9752728464622464
          },
          {
            "x": 4.013447652930445,
            "y": 3.935603565040587
          },
          {
            "x": 3.9152977740897152,
            "y": 3.8952400189930954
          },
          {
            "x": 3.817894156209742,
            "y": 3.868430071577846
          },
          {
            "x": 3.7114638921834446,
            "y": 3.863429921764711
          },
          {
            "x": 3.5972345740025173,
            "y": 3.8714394145988833
          },
          {
            "x": 3.484609231084337,
            "y": 3.8794721830711887
          },
          {
            "x": 3.3829908928462826,
            "y": 3.8745418601724513
          },
          {
            "x": 3.3017825887057337,
            "y": 3.843662078893496
          },
          {
            "x": 3.244640144396117,
            "y": 3.7799261747860995
          },
          {
            "x": 3.2050062918553412,
            "y": 3.6918828835156203
          },
          {
            "x": 3.1776810988767905,
            "y": 3.5902377418316065
          },
          {
            "x": 3.157464633253851,
            "y": 3.4856962864836056
          },
          {
            "x": 3.1391569627799094,
            "y": 3.388964054221166
          },
          {
            "x": 3.126621547209033,
            "y": 3.3079759104538726
          },
          {
            "x": 3.1213184922503756,
            "y": 3.2281527363020808
          },
          {
            "x": 3.1191827228501317,
            "y": 3.1485953532034925
          },
          {
            "x": 3.1161491639544927,
            "y": 3.068404582595808
          },
          {
            "x": 3.1081527405096545,
            "y": 2.98668124591673
          },
          {
            "x": 3.0850388411130685,
            "y": 2.8934915266515486
          },
          {
            "x": 3.050254481591022,
            "y": 2.79578702958872
          },
          {
            "x": 3.0173810664008776,
            "y": 2.698714485889361
          },
          {
            "x": 3,
            "y": 2.6074206267145885
          },
          {
            "x": 3.011692686845751,
            "y": 2.5270521832255195
          },
          {
            "x": 3.0599888938790683,
            "y": 2.4610025812668073
          },
          {
            "x": 3.135930718962784,
            "y": 2.4051227730948894
          },
          {
            "x": 3.2275467456611744,
            "y": 2.3552002266505023
          },
          {
            "x": 3.3228655575385173,
            "y": 2.3070224098743837
          },
          {
            "x": 3.4099157381590888,
            "y": 2.2563767907072676
          },
          {
            "x": 3.485845776517125,
            "y": 2.1980701796633397
          },
          {
            "x": 3.560412634188381,
            "y": 2.133708671769984
          },
          {
            "x": 3.635248686077089,
            "y": 2.072862790327865
          },
          {
            "x": 3.7119863070874817,
            "y": 2.0251030586376495
          },
          {
            "x": 3.792257872123792,
            "y": 2.0000000000000004
          },
          {
            "x": 3.8771084090556514,
            "y": 2.005445374047052
          },
          {
            "x": 3.9651845160102734,
            "y": 2.0351478009915485
          },
          {
            "x": 4.055340696936178,
            "y": 2.0772980253311855
          },
          {
            "x": 4.146431455781884,
            "y": 2.1200867915636588
          },
          {
            "x": 4.23731129649591,
            "y": 2.151704844186664
          },
          {
            "x": 4.328748373589159,
            "y": 2.16645674884583
          },
          {
            "x": 4.423199093638049,
            "y": 2.1726932007522386
          },
          {
            "x": 4.5169411630242395,
            "y": 2.1784252110157807
          },
          {
            "x": 4.606252288129393,
            "y": 2.191663790746348
          },
          {
            "x": 4.687410175335172,
            "y": 2.220419951053832
          },
          {
            "x": 4.767057085279306,
            "y": 2.268364676522411
          },
          {
            "x": 4.8461948496747596,
            "y": 2.329632708596496
          },
          {
            "x": 4.91676814156463,
            "y": 2.4000633481164004
          },
          {
            "x": 4.970721633992011,
            "y": 2.4754958959224376
          },
          {
            "x": 5,
            "y": 2.551769652854919
          },
          {
            "x": 4.9933973468573924,
            "y": 2.633186338007646
          },
          {
            "x": 4.955330983758789,
            "y": 2.7205019301035462
          },
          {
            "x": 4.9023849433526,
            "y": 2.8106003389292633
          },
          {
            "x": 4.851143258287232,
            "y": 2.9003654742714433
          }
        ]
      },
      "label": {
        "anchor": {
          "x": 3.998638405884271,
          "y": 2.9809059321974725
        },
        "text": "The Gumdrop Hills"
      }
    },
    {
      "anchor": "@anon-16",
      "line": 16,
      "section": "terrain",
      "level": "",
      "word": "licorice-forest",
      "archetype": "terrain",
      "chain": [
        "licorice-forest",
        "forest"
      ],
      "flags": [],
      "pairs": {},
      "geometry": {
        "kind": "polygon",
        "points": [
          {
            "x": 7,
            "y": 2
          },
          {
            "x": 7.0905769738298075,
            "y": 1.9848085966609945
          },
          {
            "x": 7.221618425985292,
            "y": 2.031771921372324
          },
          {
            "x": 7.375371391225875,
            "y": 2.1055115503018005
          },
          {
            "x": 7.534082904310971,
            "y": 2.1706490596172356
          },
          {
            "x": 7.68,
            "y": 2.1918060254864393
          },
          {
            "x": 7.81751047722256,
            "y": 2.15068655195474
          },
          {
            "x": 7.953435719264422,
            "y": 2.0705726630199193
          },
          {
            "x": 8.088605722695005,
            "y": 1.9770416069094663
          },
          {
            "x": 8.223850484083725,
            "y": 1.8956706318508694
          },
          {
            "x": 8.360000000000001,
            "y": 1.8520369860716162
          },
          {
            "x": 8.500034551443608,
            "y": 1.8438650136359132
          },
          {
            "x": 8.653014687118375,
            "y": 1.8515545632425587
          },
          {
            "x": 8.799977547071338,
            "y": 1.878126400459895
          },
          {
            "x": 8.921960271349535,
            "y": 1.926601290856262
          },
          {
            "x": 9,
            "y": 1.9999999999999996
          },
          {
            "x": 9.003442197081638,
            "y": 2.145232225069678
          },
          {
            "x": 8.92140442693883,
            "y": 2.3435283401507347
          },
          {
            "x": 8.805710815202392,
            "y": 2.571208342696953
          },
          {
            "x": 8.70818548750313,
            "y": 2.8045922301621147
          },
          {
            "x": 8.68065256947186,
            "y": 3.02
          },
          {
            "x": 8.758642062618714,
            "y": 3.2274868177315925
          },
          {
            "x": 8.908290933729416,
            "y": 3.431101680667271
          },
          {
            "x": 9.081672336478778,
            "y": 3.63297313473715